Position,Artist,Song Title,Year,Lyrics
24,Petula Clark,Downtown,1965,"When you're alone and life is making you lonely
You can always go - downtown.
When you've got worries all the noise and the hurry
Seems to help I know downtown.

Just listen to the music of the traffic in the city
Linger on the sidewalk where the neon signs are pretty
How can you lose?

The lights are much brighter there
you can forget all your troubles, forget all your cares
so go downtown
Things will be great when you're downtown
No finer place for sure downtown
Everything's waiting for you.

Don't hang around and let your problems surround you
There are movie shows downtown.
Maybe you know some little places to go to
where they never close downtown.

Just listen to the rhythm of a gentle bossa nova

You'll be dancing with 'em too before the night is over

happy again.
The lights are much brighter there
you can forget all your troubles, forget all your cares
so go - downtown
Where all the lights are bright downtown
waiting for you tonight downtown
you're gonna be alright now
downtown
downtown

downtown
And you may find somebody kind to help and understand you
Someone who is just like you and needs a gentle hand to

guide them along.
So maybe I'll see you there
we can forget all our troubles, forget all our cares
so go downtown
Things will be great when you're downtown

don't wait a minute more downtown
Everything is waiting for you
downtown
downtown
downtown
downtown
downtown
downtown
downtown..."
25,The Beatles,Penny Lane,1967,"In Penny Lane there is a barber showing photographs
Of every head he's had the pleasure to know
And all the people that come and go
Stop and say hello

On the corner is a banker with a motorcar
The little children laugh at him behind his back
And the banker never wears a mac in the pouring rain
Very strange

Penny Lane is in my ears and in my eyes
Wet beneath the blue suburban skies
I sit and meanwhile back in

Penny Lane there is a fireman with an hourglass
And in his pocket is a portrait of the Queen
He likes to keep his fire engine clean
It's a clean machine

Penny Lane is in my ears and in my eyes
A four of fish and finger pies
In summer meanwhile back

Behind the shelter in the middle of a roundabout
A pretty nurse is selling poppies from a tray
And though she feels as if she's in a play
She is anyway

Penny Lane, the barber shaves another customer
We see the banker sitting waiting for a trim
And the fireman rushes in from the pouring rain
Very strange

Penny Lane is in my ears and in my eyes
There beneath the blue suburban skies
I sit and meanwhile back

Penny Lane is in my ears and in my eyes
There beneath the blue suburban skies
Penny Lane"
26,The Beach Boys,Good Vibrations,1966,"I-I love the colorful clothes she wears
And the way the sunlight plays upon her hair
I hear the sound of a gentle word
On the wind that lifts her perfume through the air

I'm pickin' up good vibrations
She's giving me excitations (Oom bop bop)
I'm pickin' up good vibrations (Good vibrations, oom bop bop)
She's giving me excitations (Excitations, oom bop bop)
Good, good, good, good vibrations (Oom bop bop)
She's giving me excitations (Excitations, oom bop bop)
Good, good, good, good vibrations (Oom bop bop)
She's giving me excitations (Excitations)

Close my eyes, she's somehow closer now
Softly smile, I know she must be kind
When I look in her eyes
She goes with me to a blossom world

I'm pickin' up good vibrations
She's giving me excitations (Oom bop bop)
I'm pickin' up good vibrations (Good vibrations, oom bop bop)
She's giving me excitations (Excitations, oom bop bop)
Good, good, good, good vibrations (Oom bop bop)
She's giving me excitations (Excitations, oom bop bop)
Good, good, good, good vibrations (Oom bop bop)
She's giving me excitations (Excitations)

(Ahh)
(Ah, my my, what elation)
I don't know where but she sends me there
(Oh, my my, what a sensation)
(Oh, my my, what elation)
(Oh, my my, what)

Gotta keep those lovin' good vibrations a-happenin' with her
Gotta keep those lovin' good vibrations a-happenin' with her
Gotta keep those lovin' good vibrations a-happenin'

(Ahh)

Good, good, good, good vibrations (Oom bop bop)
(I'm pickin' up good vibrations) (Oom bop bop)
She's giving me excitations (Excitations, oom bop bop)
Good, good, good, good vibrations

Na na na na na, na na na
Na na na na na, na na na (Bop bop-bop-bop-bop, bop)
Do do do do do, do do do (Bop bop-bop-bop-bop, bop)
Do do do do do, do do do (Bop bop-bop-bop-bop, bop)"
27,Bee Gees,(The Lights Went Out In) Massachusetts,1967,"Feel I'm goin' back to Massachusetts
Something is telling me I must go home
And the lights all went out in Massachusetts
The day I left her standing on her own

Tried to hitch a ride to San Francisco
Gotta do the things I wanna do
And the lights all went out in Massachusetts
They brought me back to see my way with you

Talk about the life in Massachusetts
Speak about the people I have seen
And the lights all went out in Massachusetts
And Massachusetts is one place I have seen

I will remember Massachusetts"
28,The Animals,House of the Rising Sun,1964,"There is a house in New Orleans
They call the Rising Sun
And it's been the ruin of many a poor boy
And God, I know I'm one

My mother was a tailor
She sewed my new blue jeans
My father was a gamblin' man
Down in New Orleans

Now the only thing a gambler needs
Is a suitcase and trunk
And the only time he's satisfied
Is when he's on a drunk

Oh, mother, tell your children
Not to do what I have done
Spend your lives in sin and misery
In the house of the rising sun

Well, I got one foot on the platform
The other foot on the train
I'm goin' back to New Orleans
To wear that ball and chain

Well, there is a house in New Orleans
They call the Rising Sun
And it's been the ruin of many a poor boy
And God, I know I'm one"
29,Mary Hopkin,Those Were the Days,1968,"Once upon a time there was a tavern
Where we used to raise a glass or two.
Remember how we laughed away the hours
And thinking of all the great things we would do.

Those were the days, my friend,
We thought they'd never end,
We'd sing and dance forever and a day;
We'd live the life we choose we'd fight and never lose
For we were young and sure to have our way.

La la la la la la,
La la la la la la,
La la la la la la la la la la.

Then the busy years went rushing by us,
We lost our starry notions on the way.
If by chance I'd see you in the tavern,
We'd smile at one another and we'd say.

Those were the days, my friend,
We thought they'd never end,
We'd sing and dance forever and a day;
We'd live the life we choose we'd fight and never lose
Those were the days, oh yes, those were the days.

La la la la la la,
La la la la la la,
La la la la la la la la la la.

Just tonight I stood before the tavern,
Nothing seemed the way it used to be.
In the glass I saw a strange reflection,
Was that lonely woman really me?

Those were the days, my friend,
We thought they'd never end,
We'd sing and dance forever and a day;
We'd live the life we choose we'd fight and never lose
Those were the days, oh yes, those were the days.

La la la la la la,
La la la la la la,
La la la la la la la la la la.
La la la la la la,
La la la la la la,
La la la la la la la la la la.

Through the door there came familiar laughter,
I saw your face and heard you call my name.
Oh my friend we're older but no wiser,
For in our hearts the dreams are still the same.

Those were the days, my friend,
We thought they'd never end,
We'd sing and dance forever and a day;
We'd live the life we choose we'd fight and never lose
Those were the days, oh yes, those were the days.

La la la la la la,
La la la la la la,
La la la la la la la la la la.
La la la la la la,
La la la la la la,
La la la la la la la la la la."
30,The Beatles,I Feel Fine,1964,"Baby's good to me
You know she's happy as can be
You know she said so
I'm in love with her and I feel fine

Baby says she's mine
You know she tells me all the time
You know she said so
I'm in love with her and I feel fine

I'm so glad that she's my little girl
She's so glad, she's telling all the world

That her baby buys her things
You know he buys her diamond rings
You know she said so
She's in love with me and I feel fine

Baby says she's mine
You know she tells me all the time
You know she said so
I'm in love with her and I feel fine

I'm so glad that she's my little girl
She's so glad, she's telling all the world

That her baby buys her things
You know he buys her diamond rings
You know she said so
She's in love with me and I feel fine
She's in love with me and I feel fine"
31,The Beatles,Paperback Writer,1966,"Paper back writer
  (Paperback writer)
(Paperback writer)

Dear Sir or Madam, will you read my book?
It took me years to write, will you take a look?
It's based on a novel by a man named Lear
And I need a job so I want to be
A paperback writer, paperback writer

It's the dirty story of a dirty man
And his cleaning wife just doesn't understand
His son is working for the Daily Mail
It's a steady job but he wants to be
A paperback writer, paperback writer

Paper back writer
  (Paperback writer)
(Paperback writer)

It's a thousand pages, give or take a few
I'll be writing more in a week or two
I can make it longer if you like the style
I can change it 'round then I want to be
A paperback writer, paperback writer

If you really like it you can have the rights
It could make a million for you overnight
If you must return it, you can send it here
But I need a break and I want to be
A paperback writer, paperback writer

Paper back writer
  (Paperback writer)
(Paperback writer)

Paper back writer
  (Paperback writer)
Paper back writer
  (Paperback writer)

Paper back writer
  (Paperback writer)
Paper back writer
  (Paperback writer)"
32,The Rolling Stones,Honky Tonk Woman,1969,"I met a gin soaked, bar-room queen in memphis,
She tried to take me upstairs for a ride.
She had to heave me right across her shoulder
cause I just cant seem to drink you off my mind.

Its the honky tonk women
Gimme, gimme, gimme the honky tonk blues.

I laid a divorcee in new york city,
I had to put up some kind of a fight.
The lady then she covered me with roses,
She blew my nose and then she blew my mind.

Its the honky tonk women
Gimme, gimme, gimme the honky tonk blues.

(yeah!) its the honky tonk women.
Gimme, gimme, gimme the honky tonk blues.

(yeah!) its the honky tonk women.
Gimme, gimme, gimme the honky tonk blues"
33,The Beatles,A Hard Day's Night,1964,"It's been a hard day's night, and I've been working like a dog
It's been a hard day's night, I should be sleeping like a log
But when I get home to you I find the things that you do
Will make me feel alright

You know I work all day to get you money to buy you things
And it's worth it just to hear you say you're gonna give me everything
So why on earth should I moan, 'cause when I get you alone
You know I feel OK

When I'm home, everything seems to be right
When I'm home, feeling you holding me tight, tight

It's been a hard day's night, and I've been working like a dog
It's been a hard day's night, I should be sleeping like a log
But when I get home to you I find the things that you do
Will make me feel alright owww!

So why on earth should I moan, 'cause when I get you alone
You know I feel OK

When I'm home, everything seems to be right
When I'm home, feeling you holding me tight, tight

It's been a hard day's night, and I've been working like a dog
It's been a hard day's night, I should be sleeping like a log
But when I get home to you I find the things that you do
Will make me feel alright
You know I feel alright
You know I feel alright"
34,Zager & Evans,In the Year 2525 (Exordium & Terminus),1969,We do not have the lyrics for In the Year 2525 (Exordium and Terminus) yet.
35,Elvis Presley,Suspicious Minds,1969,"We're caught in a trap
I can't walk out
Because I love you too much baby

Why can't you see
What you're doing to me
When you don't believe a word I say?

We can't go on together
With suspicious minds
And we can't build our dreams
On suspicious minds

So, if an old friend I know
Drops by to say hello
Would I still see suspicion in your eyes?

Here we go again
Asking where I've been
You can't see these tears are real
I'm crying

We can't go on together
With suspicious minds
And we can't build our dreams
On suspicious minds

Oh let our love survive
Or dry the tears from your eyes
Let's don't let a good thing die

When honey, you know
I've never lied to you
Mmm yeah, yeah

We're caught in a trap
I can't walk out
Because I love you too much baby

Why can't you see
What you're doing to me
When you don't believe a word I say?

We're caught in a trap
I can't walk out
Because I love you too much baby

Don't you know I'm caught in a trap
I can't walk out
Because I love you too much baby

Don't you know I'm caught in a trap
I can't walk out
Because I love you too much baby

Don't you know I'm caught in a trap
I can't walk out
Because I love you too much baby
â€¦"
36,Pat Boone,Speedy Gonzales,1962,"It was a moonlit night in Old Mexico.
I walked alone between some old adobe haciendas.
Suddenly, I heard the plaintive cry of a young Mexican girl:

La la la, la la la la la la la la, la la la la la la la la, la la la la
la la la la.

You better come home Speedy Gonzales, away from tannery row.
Stop all of your drinking with that floosie named Flo!
Come on home to your adobe and slap some mud on the wall!
The roof is leaking like a strainer. There's loads of roaches in the
hall.
(La la la la)

Speedy Gonzales (Speedy Gonzales),
why don't you come home?
Speedy Gonzales (Speedy Gonzales),
how come you leave me all alone?

""He, Rosita, I have to go shopping downtown for my mother,
she needs some Tortillias and Chilli Pepper!""

La, la la la la la la la la, la la la la la la la la, la la la la la la
la la.

Your doggie's gonna have a puppy, and we're running out of Coke.
no enchiladas in the icebox, and the television's broke.
I saw some lipstick on your sweatshirt, I smell some perfume in your
ear.
Well, if you're gonna keep on messin', don't bring your business back
a-here.
(La la la la)

Mmm, Speedy Gonzales (Speedy Gonzales),
why don't you come home?
Speedy Gonzales (Speedy Gonzales),
how come you leave me all alone?

""He, Rosita, come quick!
Down at the cantina, they're giving green stamps with Tequila!""

La, la la la la la la la la, la la la la la la la la, la la la la la la
la la
La la la la, la la la la la la la la, la la la la la la la la, la la la
la la la la la."
37,The Beatles,Yellow Submarine,1966,"In the town where I was born
Lived a man who sailed to sea
And he told us of his life
In the land of submarines

So we sailed up to the sun
Till we found the sea of green
And we lived beneath the waves
In our yellow submarine

We all live in a yellow submarine
Yellow submarine, yellow submarine
We all live in a yellow submarine
Yellow submarine, yellow submarine

And our friends are all on board
Many more of them live next door
And the band begins to play

We all live in a yellow submarine
Yellow submarine, yellow submarine
We all live in a yellow submarine
Yellow submarine, yellow submarine

[Full speed ahead, Mr. Parker, full speed ahead!
Full speed over here, sir!
Action station! Action station!
Aye, aye, sir, fire!
Heaven! Heaven!]

As we live a life of ease (A life of ease)
Everyone of us (Everyone of us) has all we need (Has all we need)
Sky of blue (Sky of blue) and sea of green (Sea of green)
In our yellow (In our yellow) submarine (Submarine, ha, ha)

We all live in a yellow submarine
Yellow submarine, yellow submarine
We all live in a yellow submarine
Yellow submarine, yellow submarine
We all live in a yellow submarine
Yellow submarine, yellow submarine
We all live in a yellow submarine
Yellow submarine, yellow submarine"
38,Simon & Garfunkel,The Sounds of Silence,1966,"Hello darkness, my old friend
I've come to talk with you again
Because a vision softly creeping
Left its seeds while I was sleeping
And the vision that was planted in my brain
Still remains within the sound of silence

In restless dreams, I walked alone
Narrow streets of cobblestone
'Neath the halo of a street lamp
I turned my collar to the cold and damp
When my eyes were stabbed by the flash of a neon light
That split the night and touched the sound of silence

And in the naked light, I saw
Ten thousand people, maybe more
People talking without speaking
People hearing without listening
People writing songs that voices never share
And no one dare disturb the sound of silence

""Fools"" said I, you do not know
Silence like a cancer grows
Hear my words, that I might teach you
Take my arms, that I might reach you
But my words like silent raindrops fell
And echoed in the wells of silence

And the people bowed and prayed
To the neon God they made
And the sign flashed out its warning
In the words that it was forming
And the sign said, ""The words of the Prophets
Are written on the subway walls and tenement halls""
And whispered in the sounds of silence"
39,The Rolling Stones,Jumpin' Jack Flash,1968,"One, two!

I was born in a crossfire hurricane
And I howled at my ma in the drivin' rain

But it's all right now, in fact it's a gas
But it's all right, I'm jumpin' jack flash
It's a gas, gas, gas

I was raised by a toothless, bearded hag
I was schooled with a strap right across my back

But it's all right now, in fact it's a gas
But it's all right, I'm jumpin' jack flash
It's a gas, gas, gas
Ooh

I was drowned, I was washed up and left for dead
I fell down to my feet and I saw they bled, yeah yeah
I frowned at the crumbs of a crust of bread, yeah yeah yeah
I was crowned with a spike right through my head

But it's all right now, in fact it's a gas
But it's all right, I'm jumpin' jack flash
It's a gas, gas, gas

Jumpin' jack flash, it's a gas
Jumpin' jack flash, it's a gas
Jumpin' jack flash, it's a gas
Jumpin' jack flash, it's a gas
Jumpin' jack flash, it's a gas
Jumpin' jack flash, it's a gas"
40,Rocco Granata,Marina,1960,"Granata Rocco
Miscellaneous
Marina
Marina (Rocco Granada)

Mi sono innamorato di Marina
una ragazza mora ma carina
ma lei non vuol saperne del mio amore
cosa faro' per conquistarle il cuor.
Un girono l'ho incontrata sola sola,
il cuotre mi batteva mille all'ora.
Quando le dissi che la volevo amare
mi diede un bacio e l'amor sboccio'...

Marina, Marina, Marina
Ti voglio al piu' presto sposar
Marina, Marina, Marina
Ti voglio al piu' presto sposar

O mia bella mora
no non mi lasciare
non mi devi rovinare
oh, no, no, no, no, no..."
41,The Byrds,Mr Tambourine Man,1965,"Hey Mister Tambourine Man, play a song for me
I'm not sleepy and there ain't no place I'm goin' to
Hey Mister Tambourine Man, play a song for me
In the jingle jangle morning, I'll come followin' you

Take me for a trip upon your magic swirlin' ship
All my senses have been stripped
And my hands can't feel to grip
And my toes too numb to step
Wait only for my boot heels to be wanderin'

I'm ready to go anywhere I'm ready for to fade
On to my own parade cast your dancin' spell my way
I promise to go under it

Hey Mister Tambourine Man, play a song for me
I'm not sleepy and there ain't no place I'm goin' to
Hey Mister Tambourine Man, play a song for me
In the jingle jangle morning, I'll come followin' you"
42,The Beatles,Ticket to Ride,1965,"I think I'm gonna be sad
I think it's today, yeah
The girl that's driving me mad
Is going away

She's got a ticket to ride
She's got a ticket to ride
She's got a ticket to ride
But she don't care

She said that living with me
Is bringing her down, yeah
For she would never be free
When I was around

She's got a ticket to ride
She's got a ticket to ride
She's got a ticket to ride
But she don't care

I don't know why she's riding so high
She ought to think twice
She ought to do right by me
Before she gets to saying goodbye
She ought to think twice
She ought to do right by me

I think I'm gonna be sad
I think it's today, yeah

The girl that's driving me mad
Is going away, yeah, oh

She's got a ticket to ride
She's got a ticket to ride
She's got a ticket to ride
But she don't care

I don't know why she's riding so high
She ought to think twice
She ought to do right by me
Before she gets to saying goodbye
She ought to think twice
She ought to do right by me
She said that living with me
Was bringing her down, yeah
For she would never be free
When I was around, oh

She's got a ticket to ride
She's got a ticket to ride
She's got a ticket to ride
But she don't care
My baby don't care
My baby don't care
My baby don't care
My baby don't care
My baby don't care
My baby don't care"
43,Scott McKenzie,San Francisco (Wear Some Flowers in Your Hair),1967,"If you're going to San Francisco
Be sure to wear some flowers in your hair
If you're going to San Francisco
You're gonna meet some gentle people there

For those who come to San Francisco
Summertime will be a love-in there
In the streets of San Francisco
Gentle people with flowers in their hair

All across the nation such a strange vibration
People in motion
There's a whole generation with a new explanation
People in motion people in motion

For those who come to San Francisco
Be sure to wear some flowers in your hair
If you come to San Francisco
Summertime will be a love-in there

If you come to San Francisco
Summertime will be a love-in there"
44,Otis Redding,(Sittin' On) the Dock of the Bay,1968,"Sittin' in the morning sun
I'll be sittin' when the evening comes
Watching the ships roll in
Then I watch 'em roll away again, yeah

I'm sittin' on the dock of the bay
Watching the tide roll away
I'm just sittin' on the dock of the bay wastin' time

I left my home in Georgia, headed for the Frisco bay
'Cos I've had nothing to live for
And look like nothing's gonna come my way

So I'm just gonna sit on the dock of the bay
Watching the tide roll away
I'm sittin' on the dock of the bay wastin' time

Look like nothing's gonna change
Everything still remains the same
I can't do what ten people tell me to do
So I guess I'll remain the same, listen

Sittin' here resting my bones
And this loneliness won't leave me alone, listen
2000 miles I've roamed
Just to make this dock my home

Now I'm just gonna sit at the dock of the bay
Watching the tide roll away
I'm sittin' on the dock of the bay wastin' time"
45,Sam The Sham & The Pharaohs,Wooly Bully,1965,"Matty told Hatty
About a thing she saw
Had two big horns
And a wooly jaw

Wooly Bully
Wooly Bully
Wooly Bully
Wooly Bully
Wooly Bully

Hatty told Matty
""Let's don't take no chance
Let's not be L 7
Come and learn to dance

Wooly Bully
Wooly Bully
Wooly Bully
Wooly Bully
Wooly Bully

Matty told Hatty
""That's a thing to do
Get you someone really
Pull the wool with you

Wooly Bully
Wooly Bully
Wooly Bully
Wooly Bully
Wooly Bully"
46,The Rolling Stones,Paint it Black,1966,"I see a red door and I want it painted black.
No colours anymore, I want them to turn black.
I see the girls walk by dressed in their summer clothes
I have to turn my head until my darkness goes.

I see a line of cars and they're all painted black
With flowers and my love both never to come back.
I see people turn their heads and quickly look away.
Like a newborn baby, it just happens every day.

I look inside myself and see my heart is black.
I see my red door and must have it painted black.
Maybe then I'll fade away and not have to face the facts
It's not easy facin' up when your whole world is black.

No more will my green segel turn a deeper blue.
I could not foresee this thing happening to you.
If I look hard enough into the settin' sun
My love will laugh with me before the mornin' comes.

I see a red door and I want it painted black.
No colours anymore, I want them to turn black.
I see the girls go by dressed in their summer clothes
I have to turn my head until my darkness goes.

Hmm...
I wanna see your face painted black.
Black as night, black as coal.
I wanna see the sun blotted out from the sky.
I wanna see it painted, painted, painted, painted black, yeah!
Hmm..."
47,The Everly Brothers,Cathy's Clown,1960,"Don't want your love anymore
Don't want your kisses, that's for sure
I die each time
I hear this sound:
""Here he comes. That's Cathy's clown.""

I've gotta stand tall
You know a man can't crawl
But when he knows you're tellin' lies
And he hears them passing' by
He's not a man at all

Don't want your love anymore
Don't want your kisses, that's for sure
I die each time
I hear this sound:
""Here he comes. That's Cathy's clown.""

When you see me shed a tear
And you know that it's sincere
Don't you think it's kind of sad
That you're treating me so bad
Or don't you even care?

Don't want your love anymore
Don't want your kisses, that's for sure
I die each time
I hear this sound:
""Here he comes.
That's Cathy's clown
That's Cathy's clown
That's Cathy's clown."""
