Position,Artist,Song Title,Year,Lyrics
1,The Beatles,Hey Jude,1968,"Hey Jude, don't make it bad
Take a sad song and make it better
Remember to let her into your heart

Then you can start to make it better

Hey Jude, don't be afraid

You were made to go out and get her

The minute you let her under your skin

Then you begin to make it better

And any time you feel the pain

Hey Jude, refrain

Don't carry the world upon your shoulder

For well you know that it's a fool

Who plays it cool
By making his world a little colder
Na na na naa-naa

na-na-naa naaa
Hey Jude, don't let me down
You have found her, now go and get her
(Let it out and let it in)
Remember (hey Jude) to let her into your heart
Then you can start to make it better
So let it out and let it in
Hey Jude, begin
You're waiting for someone to perform with
And don't you know that it's just you
Hey Jude, you'll do
The movement you need is on your shoulder
Na na na naa-naa
na-na-naa naaa
Yeah
Hey, Jude, don't make it bad
Take a sad song
And make it better
Remember to let her under your skin (got the wrong chord!)
Then you begin (fucking hell)
To make it better
Better, better, better, better, (I'm begging you) better
Whoa!
Yeah
Na na na na-na-na-naa (yeah, yeah, yeah, yeah, yeah, yeah)
Na-na-na-naa, hey, Jude
Na na na na-na-na-naa
Na-na-na-naa, hey, Jude
Na na na na-na-na-naa
Na-na-na-naa, hey, Jude
Na na na na-na-na-naa
Na-na-na-naa, hey, Jude
Jude, Judy, Judy, Judy, Judy, Judy
Ow! wow!
Na na na na-na-na-naa
Ow, ooh, my, my, my
Na-na-na-naa, hey, Jude
Jude, Jude, Jude, Jude, Jude
Na na na na-na-na-naa
Yeah, yeah, yeah
Na-na-na-naa, hey, Jude
Yeah, you know you can make it, Jude
Jude, you're not gonna break it
Na na na (don't make it bad, Jude) na-na-na-naa
Take a sad song and make it better
Na-na-na-naa, (oh, Jude) hey, (Jude) Jude
Hey, Jude, wo-o-ow!
Na na na na-na-na-naa (ooh, Jude)
Na-na-na-naa, (yeah) hey, Jude
(Hey, hey, hey-ey-ey)
Na na na na-na-na-naa (hey, hey)
Na-na-na-naa, (hey, hey) hey, Jude
Now, Jude, Jude, Jude, Jude, Jude, Jude
Yeah, yeah, yeah, yeah, yeah
Na na na na-na-na-naa (whoa, yeah)
Na-na-na-naa, hey, Jude
Ah nanananananana cause I wanna na na na
Na na na na-na-na-naa
Na-na-na-naa, hey, Jude
Nanananana… nanalalal ow ow
(Okay)
Na na na na-na-na-naa
Pain won't come back, Jude
Na-na-na-naa, hey, Jude
Na na na na-na-na-naa
Na-na-na-naa, hey, Jude
(Yeah)
Na na na na-na-na-naa
(Make it through)
Na-na-na-naa, hey, Jude
Yeah, yeah, yeah, yeah, yeah, yeah, yeah, yeah
Na na na na-na-na-naa (yeah, yeah, yeah, yeah, yeah)
Na-na-na-naa, hey, Jude
(Good evening, ladies and gentleman)
ma ma ma ma ma ma ma ma ma ma
Na na na na-na-na-naa
Na-na-na-naa, hey, Jude
(Ooh)
Na na na na-na-na-naa (whoo)
Na-na-na-naa, hey, Jude
(Whoo)
(Well, then, a-na)
Na na na na-na-na-naa
Na-na-na-naa, hey, Jude
Na na na na-na-na-naa
Na-na-na-naa"
2,The Rolling Stones,(I Can't Get No) Satisfaction,1965,"Hey look
I can't get no satisfaction
I can't get no satisfaction
I try and I try and I try and I try
I can't get no, I can't get no

When I'm drivin' in my car
And that man comes on the radio
And he's tellin' me more and more
About some useless information
Supposed to drive my imagination
I can't get no, no no
Hey hey hey, that's what I say

I can't get no satisfaction
I can't get no satisfaction
I try and I try and I try and I try
I can't get no, I can't get no

When I'm watchin' my TV
And a man comes on to tell me
How white my shirts can be
Well he can't be a man 'cause he doesn't smoke
The same cigarettes as me
I can't get no, no no no
Hey hey hey, that's what I say

I can't get no satisfaction
I can't get no girl reaction
I try and I try and I try and I try try try
I can't get no, I can't get no

When I'm ridin' round the world
And I'm doin' this and I'm signing that
And I'm tryin' to make some girl
Who tells me baby better come back later next week
You see I'm on losing streak
I can't get no, no no no
Hey hey hey, that's what I say

I
Do some
[Incomprehensible] satisfaction
I won't get satisfaction
We don't get satisfaction
You don't see satisfaction

[Incomprehensible]
Hey, I say

[Incomprehensible]
Yeah
Yeah"
3,Procol Harum,A Whiter Shade of Pale,1967,"Procol Harum
Miscellaneous
A Whiter Shade Of Pale
We skipped the light fandango
And turned cartwheels across the floor
I was feeling kind of seasick
The crowd called out for more
The room was humming harder
As the ceiling flew away
Whe we called out for another drink
The waiter brought a tray

And so it was that later
As the miller told his tale
That her face at first just ghostly
Turned a whiter shade of pale

She said there is no reason
And the truth is plain to see
But I wandered through my playing cards
Would not let her be
One of sixteen vestal virgins
Who were leaving for the coast
At the moment my eyes were open
They might just as well have been closed

And so it was that later
As the miller told his tale
That her face at first just ghostly
Turned a whiter shade of pale"
4,The Beatles,I Want to Hold Your Hand,1964,"Oh, yeah, I tell you something
I think you'll understand
When I say that something's
I wanna hold your hand
I wanna hold your hand
I wanna hold your hand

Oh, please say to me
You'll let me be your man
And, please, say to me
You'll let me hold your hand
You'll let me hold your hand
I wanna hold your hand

And when I touch you, I feel happy inside
It's such a feeling that my love
I can't hide

I can't hide
I can't hide
Yeah, you got that something
I think you'll understand
When I say that something's
I wanna hold your hand

I wanna hold your hand
I wanna hold your hand
And when I touch you, I feel happy inside

It's such a feeling that my love
I can't hide
I can't hide
I can't hide
Yeah, you got that something
I think you'll understand
When I feel that something
I wanna hold your hand
I wanna hold your hand
I wanna hold your hand
I wanna hold your hand"
5,Roy Orbison,"Oh, Pretty Woman",1964,"Pretty woman, walkin' down the street
Pretty woman, the kind I'd like to meet
Pretty woman
I don't believe you
You're not the truth
No one can look as good as you
Mercy

Pretty woman, oh won't you pardon me
Pretty woman, I couldn't help but see
Pretty woman
You look lovely as can be
Are you lonely just like me

Pretty woman stop a while
Pretty woman talk a while
Pretty woman give your smile to me

Pretty woman, yeah yeah yeah
Pretty woman walk my way
Pretty woman say you'll stay, with me

'Cuz I need you, I'll treat you right
Come to me baby, be mine tonight

Pretty woman, don't walk on by
Pretty woman, don't make me cry
Pretty woman
Don't walk away hey, okay
If that's the way it must be okay

I guess I'll go on home it's late
Maybe tomorrow night but wait
What do I see

Is she walking back to me?
Yeah, she's walking back to me
Oh, pretty woman"
6,Elvis Presley,Are You Lonesome Tonight?,1960,"Are you lonesome tonight? Do you miss me tonight?
Are you sorry we drifted apart?
Does your memory stray to a brighter sunny day?
When I kissed you and called you sweetheart?

Do the chairs in your parlor seem empty and bare?
Do you gaze at your doorstep and picture me there?
Is your heart filled with pain? Shall I come back again?
Tell me dear, are you lonesome tonight

I wonder if you're lonesome tonight
You know someone said that the world's a stage
And each must play a part
Fate had me playing in love with you as my sweet heart

Act one was when we met, I loved you at first glance
You read your line so cleverly and never missed a cue
Then came act two, you seemed to change, you acted strange
And why? I've never known

Honey, you lied when you said you loved me
And I had no cause to doubt you
But I'd rather go on hearing your lies
Than I go on living without you

Now the stage is bare and I'm standing there
With emptiness all around
And if you won't come back to me
Then they can bring the curtain down

Is your heart filled with pain? Shall I come back again?
Tell me dear, are you lonesome tonight"
7,Elvis Presley,It's Now Or Never,1960,"It's now or never, come hold me tight
Kiss me my darling, be mine tonight
Tomorrow will be too late
It's now or never, my love won't wait

When I first saw you with your smile so tender
My heart was captured, my soul surrendered
I'd spend a lifetime, waiting for the right time
Now that you're near, the time is here at last

It's now or never, come hold me tight
Kiss me my darling, be mine tonight
Tomorrow will be too late
It's now or never, my love won't wait

Just like a willow, we would cry an ocean
If we lost true love and sweet devotion
Your lips excite me, let your arms invite me
For who knows when we'll meet again this way

It's now or never, come hold me tight
Kiss me my darling, be mine tonight
Tomorrow will be too late
It's now or never, my love won't wait

It's now or never, my love won't wait
It's now or never, my love won't wait
It's now or never, my love won't wait"
8,The Monkees,I'm a Believer,1967,"I thought love was only true in fairytales
Meant for someone else but not for me
Love was out to get me
That's the way it seemed
Disappointment haunted all my dreams

Then I saw her face, now I'm a believer
Not a trace of doubt in my mind
I'm in love, I'm a believer
I couldn't leave her if I tried

I thought love was more or less a givin' thing
Seems the more I gave the less I got
What's the use in trying?
All you get is pain
When I needed sunshine I got rain

Then I saw her face, now I'm a believer
Not a trace of doubt in my mind
I'm in love, I'm a believer
I couldn't leave her if I tried

Love was out to get me
Now that's the way it seemed
Disappointment haunted all my dreams

Oh then I saw her face, now I'm a believer
Not a trace of doubt in my mind
I'm in love, I'm a believer
I couldn't leave her if I tried

Yes I saw her face, now I'm a believer
Not a trace of doubt in my mind
Said I'm a believer, yeah, yeah, yeah, yeah, yeah
  (I'm a believer)
  (I'm a believer)
Said I'm a believer, yeah
(I'm a believer)
Said I'm a believer, yeah
(I'm a believer)"
9,The Beatles,Help!,1965,"Help, I need somebody
Help, not just anybody
Help, you know I need someone
Help!

When I was younger, so much younger than today
I never needed anybody's help in any way
But now these days are gone I'm not so self-assured
Now I find I've changed my mind and opened up the doors

Help me if you can, I'm feeling down
And I do appreciate you being 'round
Help me get my feet back on the ground
Won't you please, please help me?

And now my life has changed in oh so many ways
My independence seems to vanish in the haze
But every now and then I feel so insecure
I know that I just need you like I've never done before

Help me if you can, I'm feeling down
And I do appreciate you being 'round
Help me get my feet back on the ground
Won't you please, please help me?

When I was younger, so much younger than today
I never needed anybody's help in any way
But now these days are gone I'm not so self-assured
Now I find I've changed my mind, I've opened up the doors

Help me if you can, I'm feeling down
And I do appreciate you being 'round
Help me get my feet back on the ground
Won't you please, please help me?
Help me, help me, ooo"
10,Chubby Checker,The Twist,1960,"Come on, baby, let's do the twist
Come on, baby, let's do the twist
Take me by my little hand and go like this

Yeah, twist, baby, baby
Twist, ooh yeah, just like this
Come on, little miss, and do the twist

My daddy is sleepin' and mama ain't around
Yeah, daddy's just sleepin' and mama ain't around
We're gonna twisty, twisty, twisty
Till we tear the house down

Come on and twist, yeah, baby
Twist, ooh yeah, just like this
Come on, little miss, and do the twist, yeah

Yeah, you should see my little sis
You should see my, my little sis
She really knows how to rock
She knows how to twist

Come on and twist, yeah, baby
Twist, ooh yeah, just like this
Come on, little miss, and do the twist

Yeah, rock on now
Yeah, twist on now, twist"
11,Frank Sinatra,Strangers in the Night,1966,"Strangers in the night exchanging glances
Wondering in the night what were the chances
We'd be sharing love before the night is through

Something in your eyes was so inviting
Something in your smile was so exciting
Something in my heart told me I must have you

Strangers in the night
Two lonely people, we were strangers in the night
Up to the moment when we said our first hello
Little did we know, love was just a glance away
A warm embracing dance away and

Ever since that night we've been together
Lovers at first sight, in love forever
It turned out so right for strangers in the night
Two strangers in the night"
12,The Righteous Brothers,Unchained Melody,1965,"Oh, my love, my darling
I've hungered for your touch
A long, lonely time

And time goes by so slowly
And time can do so much
Are you still mine?

I need your love
I need your love
God speed your love to me!

Lonely rivers flow
To the sea, to the sea
To the open arms of the sea

Lonely rivers sigh
""Wait for me, wait for me""
I'll be coming home, wait for me!

Oh, my love, my darling
I've hungered, hungered for your touch
A long, lonely time

And time goes by so slowly
And time can do so much
Are you still mine?

I need your love
I need your love
God speed your love to me!"
13,The Beatles,All You Need is Love,1967,"(Love, love, love)
(Love, love, love)
(Love, love, love)

There's nothing you can do that can't be done
Nothing you can sing that can't be sung
Nothing you can say but you can learn how to play the game
It's easy

There's nothing you can make that can't me made
No one you can save that can't be saved
Nothing you can do but you can learn how to be you in time
It's easy

All you need is love
All you need is love
All you need is love, love
Love is all you need

(Love, love, love)
(Love, love, love)
(Love, love, love)

All you need is love
All you need is love
All you need is love, love
Love is all you need

There's nothing you can know that isn't known
Nothing you can see that isn't shown
There's nowhere you can be that isn't where you're meant to be
It's easy

All you need is love
All you need is love
All you need is love, love
Love is all you need

All you need is love, all together now
All you need is love, everybody
All you need is love, love
Love is all you need

Love is all you need
Love is all you need
Love is all you need
..."
14,The Beatles,She Loves You,1964,"She loves you, yeah yeah yeah
She loves you, yeah yeah yeah
She loves you, yeah yeah yeah yeah

You think you've lost your love
Well, I saw her yesterday
It's you she's thinking of
And she told me what to say

She says she loves you
And you know that can't be bad
Yes, she loves you
And you know you should be glad

She said you hurt her so
She almost lost her mind
But now she says she knows
You're not the hurting kind

She says she loves you
And you know that can't be bad
Yes, she loves you
And you know you should be glad, ooh!

She loves you, yeah yeah yeah
She loves you, yeah yeah yeah
With a love like that
You know you should be glad

You know it's up to you
I think it's only fair
Pride can hurt you too
Apologize to her

Because she loves you
And you know that can't be bad
She loves you
And you know you should be glad, ooh!

She loves you, yeah yeah yeah
She loves you, yeah yeah yeah
With a love like that
You know you should be glad

With a love like that
You know you should be glad
With a love like that
You know you should, be glad!

Yeah yeah yeah
Yeah yeah yeah yeah"
15,Archies,Sugar Sugar,1969,"Sugar, ah honey honey
You are my candy girl
And you've got me wanting you.
Honey, ah sugar sugar
You are my candy girl
And you got me wanting you

I just can't believe the lovliness of loving you,
(I just can't believe it's true)
I just can't believe the wonder of this feeling to
(I just can't believe it's true)

Ah Sugar, ah honey honey
You are my candy girl,
and you got me wanting you
Oh Honey, ah sugar sugar
you are my candy girl
and you got me wanting you

When i kissed you girl I knew how sweet a kiss could be
(I know how sweet a kiss could be)
Like the summer sunshine pour your sweetness over me
(Pour your sweetness over me)

Pour a little sugar on it honey
Pour a little sugar on it Baby
I'm gonna make your life so sweet, yeah yeah yeah
pour a little sugar on it oh yeah
pour a little sugar on it honey
pour a little sugar on it baby
I'm gonna make your life so sweet, yeah yeah yeah
pour a little sugar on it honey

Ah sugar, ah honey honey
you are my candy girl
and you got me wanting you
Oh honey, sugar sugar...
You are my candy girl"
16,The Beatles,Yesterday,1965,"Yesterday, all my troubles seemed so far away
Now it looks as though they're here to stay
Oh, I believe in yesterday

Suddenly, I'm not half the man I used to be
There's a shadow hanging over me
Oh, yesterday came suddenly

Why she had to go
I don't know, she wouldn't say
I said something wrong
Now I long for yesterday

Yesterday, love was such an easy game to play
Now I need a place to hide away
Oh, I believe in yesterday

Why she had to go
I don't know, she wouldn't say
I said something wrong
Now I long for yesterday

Yesterday, love was such an easy game to play
Now I need a place to hide away
Oh, I believe in yesterday"
17,The Beatles,Get Back,1969,"Jojo was a man who thought he was a loner
But he knew it couldn't last.
Jojo left his home in Tucson, Arizona
For some California grass.
Get back, get back.
Get back to where you once belonged
Get back, get back.
Get back to where you once belonged.
Get back Jojo, go home
Get back, get back.
Get back to where you once belonged
Get back, get back.
Back to where you once belonged.
Get back Jo.
Sweet Loretta Martin thought she was a woman
But she was another man
All the girls around her say she's got it coming
But she gets it while she can
Get back, get back.
Get back to where you once belonged
Get back, get back.
Get back to where you once belonged.
Get back Loretta
Your mother's waiting for you
Wearing her high-heel shoes
And her low-neck sweater
Get back Loretta,
Get back, get back to where you once belonged
Get back, get back.
Get back to where you once belonged.
Get back, get back.
Get back to where you once belonged.
Get back, get back.
Get back to where you once belonged."
18,Percy Faith,Theme From 'A Summer Place',1960,"There's a summer place
Where it may rain or storm
Yet I'm safe and warm

For within that summer place
Your arms reach out to me
And my heart is free from all care for it knows

There are no gloomy skies
When seen through the eyes
Of those who are blessed with love

And the sweet secret of
A summer place
Is that it's anywhere

When two people share
All their hopes, all their dreams
All their love

There's a summer place
Where it may rain or storm
Yet I'm safe and warm

In your arms, in your arms
In your arms, in your arms
In your arms, in your arms"
19,The Beatles,"Hello, Goodbye",1967,"You say yes, I say no.
You say stop and I say go go go, oh no.
You say goodbye and I say hello
Hello hello
I don't know why you say goodbye, I say hello
Hello hello
I don't know why you say goodbye, I say hello.
I say high, you say low.
You say why and I say I don't know, oh no.
You say goodbye and I say hello
hello hello
I don't know why you say goodbye, I say hello
hello hello
I don't know why you say goodbye
I say hello.
Oh no,
You say goodbye and I say hello
Hello hello
I don't know why you say goodbye
I say hello.
Hello hello
I don't know why I say goodbye
I say hello
You say yes (I say yes)
I say no (But I'm naming no)
You say stop (I can stay)
and I say go go go (till it's time to go)
Oh no
You say goodbye and I say hello
Hello hello
I don't know why you say goodbye, I say hello
Hello hello
I don't know why you say goodbye, I say hello
Hello hello
I don't know why you say goodbye, I say hello hello

Hela heba helloa
Hela heba helloa, cha cha cha
Hela heba helloa, wooo
Hela heba helloa, hela
Hela heba helloa, cha cha cha
Hela heba helloa, wooo
Hela heba helloa, cha cah cah"
20,Nancy Sinatra,These Boots Are Made For Walking,1966,"You keep saying, you got something for me
Something you call love but confess
You've been messin' where you shouldn't have been messin'
And now someone else is getting all your best

These boots are made for walking
And that's just what they'll do
One of these days these boots
Are gonna walk all over you

Yeah, you keep lyin' when you oughta be truthin'
And you keep losing when you oughta not bet
You keep samin' when you oughta be changin'
Now, what's right is right but you ain't been right yet

These boots are made for walking
And that's just what they'll do
One of these days these boots
Are gonna walk all over you

You keep playin' where you shouldn't be playin'
And you keep thinkin' that you'll never get burnt
Ah, I've just found me a brand new box of matches, yeah
And what he knows you ain't had time to learn

These boots are made for walking
And that's just what they'll do
One of these days these boots
Are gonna walk all over you

Are you ready, boots?
Start walking"
21,Ray Charles,I Can't Stop Loving You,1962,"I've made up my mind
To live in memories of the lonesome times
(I can't stop wanting you)

It's useless to say
So I'll just live my life of dreams of yesterday
(Dreams of yesterday)
Those happy hours that we once knew

Tho' long ago, they still make me blue
They say that time heals a broken heart
But time has stood still since we've been apart
(I can't stop loving you)

I've made up my mind
To live in memories of the lonesome times
(I can't stop wanting you)

It's useless to say
So I'll just live my life of dreams of yesterday
(Those happy hours)
Those happy hours

(That we once knew)
That we once knew
(Tho' long ago)

Tho' long ago
(Still make me blue)
Still make me blue
(They say that time)

They say that time
(Heals a broken heart)
Heals a broken heart
(But time has stood still)

Time has stood still
(Since we've been apart)
Since we've been apart
(I can't stop loving you)
I said I made up my mind
To live in memories of the lonesome times
Sing the song, children
(I can't stop wanting you)
It's useless to say
So I'll just live my life of dreams of yesterday
(Of yesterday)"
22,Chubby Checker,Let's Twist Again,1961,"Come on everybody, clap your hands
Are you lookin' good?
I'm gonna sing my song
It won't take long
We're gonna do the twist and it goes like this

Come on, let's twist again like we did last summer
Yeah, let's twist again like we did last year
Do you remember when things were really hummin'?
Yeah, let's twist again, twistin' time is here

Ee, a round and round and up and down we go again
Oh, baby make me know you love me so and then
Twist again like we did last summer
Come on, let's twist again
Like we did last year
Twist, yo

Who's that flyin' up there
Is it a bird? No
Is it a plane? No
Is it the twister? Yeah

Yeah, twist again like we did last summer
Come on, let's twist again like we twist last year
Do you remember when things were really hummin'?
Come on, let's twist again, twistin' time is here

Ee, a round and round and up and down we go again
Oh, baby make me know you love me so and then
Come on, twist again like we did last summer
Girl, let's twist again
Like we did last year

Come on, lets twist again
Twistin' time is here"
23,Ben E King,Stand By Me,1961,"When the night has come and the land is dark
And the moon is the only light we see
No, I won't be afraid, oh, I won't be afraid
Just as long as you stand, stand by me

So darling, darling, stand by me, oh, stand by me
Oh, stand, stand by me, stand by me

If the sky that we look upon should tumble and fall
Or the mountain should crumble to the sea
I won't cry, I won't cry, no, I won't shed a tear
Just as long as you stand, stand by me

And darling, darling, stand by me
Darling, darling, stand by me
Whenever you're in trouble
Won't you stand by me, oh, stand by me"
