Position,Artist,Song Title,Year,Lyrics
48,The Beatles,Come Together,1969,"Here come old flattop, he come grooving up slowly
He got joo-joo eyeball, he one holy roller
He got hair down to his knee
Got to be a joker he just do what he please

He wear no shoeshine, he got toe-jam football
He got monkey finger, he shoot Coca-Cola
He say, ""I know you, you know me.""
One thing I can tell you is you got to be free

Come together right now over me

He bag production, he got walrus gumboot
He got Ono sideboard, he one spinal cracker
He got feet down below his knee
Hold you in his armchair you can feel his disease

Come together right now over me

(Right!
Come, oh, come, come, come.)

He roller-coaster, he got early warning
He got muddy water, he one mojo filter
He say, ""One and one, and one is three.""
Got to be good-looking 'cause he's so hard to see

Come together right now over me

Oh
Come together
Yeah, come together
Yeah, come together
Yeah, come together
Yeah, come together
Yeah, come together
Yeah, come together
Yeah, oh
Come together
Yeah, come together"
49,The Monkees,Daydream Believer,1967,"Oh, I could hide 'neath the wings of the bluebird as she sings
The six o'clock alarm would never ring
But it rings and I rise wipe the sleep out of my eyes
The shavin' razor's cold, and it stings

Cheer up, sleepy Jean, oh what can it mean
To a daydream believer and a homecoming queen?

You once thought of me as a white knight on his steed
Now you know how happy I can be
Oh, and our good times start and end without dollar one to spend
But how much baby do we really need?

Cheer up, sleepy Jean, oh what can it mean
To a daydream believer and a homecoming queen?
Cheer up, sleepy Jean, oh what can it mean
To a daydream believer and a homecoming queen?

Cheer up, sleepy Jean, oh what can it mean
To a daydream believer and a homecoming queen?
Cheer up, sleepy Jean, oh what can it mean
To a daydream believer and a homecoming queen?

Cheer up, sleepy Jean, oh what can it mean
To a daydream believer and a homecoming queen?"
50,Elvis Presley,Surrender,1961,"When we kiss my heart's on fire
Burning with a strange desire
And I know, each time I kiss you
That your heart's on fire too

So, my darling, please surrender
All your love so warm and tender
Let me hold you in my arms, dear
While the moon shines bright above

All the stars will tell the story
Of our love and all it's glory
Let us take this night of magic
And make it a night of love

Won't you please surrender to me?
Your lips, your arms, your heart, dear
Be mine forever, be mine tonight"
51,The Tornados,Telstar,1962,"Exception occurred 
HTTP Error 404: Not Found"
52,Elvis Presley,(You're The) Devil in Disguise,1963,"You look like an angel
Walk like an angel
Talk like an angel
But I got wise

You're the devil in disguise
Oh yes, you are the devil in disguise
You fooled me with your kisses
You cheated and you schemed
Heaven knows how you lied to me
You're not the way you seemed

You look like an angel
Walk like an angel
Talk like an angel
But I got wise

You're the devil in disguise
Oh yes, you are the devil in disguise
I thought that I was in heaven
But I was sure surprised
Heaven help me, I didn't see
The devil in your eyes

You look like an angel
Walk like an angel
Talk like an angel
But I got wise

You look devil in disguise
Oh yes, you are the devil in disguise

You look devil in disguise
Oh yes, you are the devil in disguise
Oh yes, you are the devil in disguise
Oh yes, you are the devil in disguise"
53,The Righteous Brothers,You've Lost That Lovin' Feelin',1964,"You never close your eyes anymore when I kiss your lips.
And there's no tenderness like before in your fingertips.
You're trying hard not to show it, (baby).
But baby, baby I know it...

You've lost that lovin' feeling
Whoa, that lovin' feeling
You've lost that lovin' feeling
Now it's gone... gone... gone... wooooooh.

Now there's no welcome look in your eyes when I reach for you.
And now your're starting to critisize little things I do.
It makes me just feel like crying, (baby).
'Cause baby, something in you is dying.

You lost that lovin' feeling
Whoa, that lovin' feeling
You've lost that lovin' feeling
Now it's gone... gone... gone... woooooah

Baby, baby, I get down on my knees for you.
If you would only love me like you used to do, yeah.
We had a love... a love... a love you don't find everyday.
So don't... don't... don't... don't let it slip away.

Baby (baby), baby (baby)
I beg of you please... please
I need your love (I need your love), I need your love (I need your love)
So bring it on back (So bring it on back), Bring it on back (so bring it on back).
Bring back that lovin' feeling
Whoa, that lovin' feeling

Bring back that lovin' feeling
'Cause it's gone... gone... gone
and I can't go on
noooo...
Bring back that lovin' feeling
Whoa, that lovin' feeling
Bring back that lovin' feeling
'Cause it's gone... gone..."
54,Elvis Presley,Return to Sender,1962,"Return to sender
Return to sender

I gave a letter to the postman
He put it in his sack
Bright in early next morning
He brought my letter back

She wrote upon it
Return to sender, address unknown
No such number, no such zone

We had a quarrel, a lover's spat
I write I'm sorry
But my letter keeps coming back

So when I dropped it in the mailbox
And sent a special D
Bright in early next morning
It came right back to me

She wrote upon it
Return to sender, address unknown
No such person, no such zone

This time I'm gonna take it myself
And put it right in her hand
And if it comes back the very next day
Then I'll understand the writing on it

Return to sender, address unknown
No such number, no such zone

Return to sender
Return to sender
Return to sender
Return to sender"
55,The Mamas & The Papas,Monday Monday,1966,"Monday, Monday, so good to me
Monday morning, it was all I hoped it would be
Oh, Monday morning, Monday morning couldn't guarantee
That Monday evening you would still be here with me

Monday, Monday, can't trust that day
Monday, Monday, sometimes it just turns out that way
Oh, Monday morning, you gave me no warning of what was to be
Oh, Monday, Monday, how could you leave and not take me?

Every other day, every other day
Every other day of the week is fine, yeah
But whenever Monday comes but whenever Monday comes
You can find me crying all of the time

Monday, Monday, so good to me
Monday morning, it was all I hoped it would be
But Monday morning, Monday morning couldn't guarantee
That Monday evening you would still be here with me

Every other day, every other day
Every other day of the week is fine, yeah
But whenever Monday comes but whenever Monday comes
You can find me crying all of the time

Monday, Monday, can't trust that day
Monday, Monday, it just turns out that way
Oh, Monday, Monday, won't go away
Monday, Monday, it's here to stay
Oh Monday, Monday, oh Monday, Monday, oh"
56,Del Shannon,Runaway,1961,"As I walk along, I wonder
A-what went wrong with our love
A love that was so strong

And as I still walk on, I think of
The things we've done together
While our hearts were young

I'm a-walkin' in the rain
Tears are fallin', and I feel the pain
A-wishin' you were here by me
To end this misery

And I wonder
I wah-wah-wah-wah-wonder
Why
Why, why, why, why, why
She ran away
And I wonder
Where she will stay-ay
My little runaway
A-run, run, run, run, runaway

I'm a-walkin' in the rain
Tears are fallin', and I feel the pain
A-wishin' you were here by me
To end this misery
And I wonder
I wah-wah-wah-wah-wonder
Why
Why, why, why, why, why
She ran away
And I wonder
Where she will stay-ay
My little runaway
A-run, run, run, run, runaway
A-run, run, run, run, runaway
A-run, run, run, run, runaway"
57,Fifth Dimension,Aquarius/Let The Sunshine In,1969,"Fifth Dimension
The Forrest Gump Soundtrack
Aquarius - Let The Sunshine In
When the moon is in the seventh house
And Jupiter aligns with Mars
The peace will guide the planets
And love will steer the stars
This is the dawning of the age of Aquarius
Age of Aquarius
Aquarius, Aquarius

Harmony and understanding, sympathy and trust abounding
No more false hoods or derisions, golden living dreams of visions
Mystic crystal revelations, and the mind's true liberations
Aquarius, Aquarius

When the moon is in the seventh house
And Jupiter aligns with Mars
The peace will guide the planets
And love will steer the stars
This is the dawning of the age of Aquarius
Age of Aquarius
Aquarius, Aquarius
Aquarius

Let the sunshine, let the sunshine in
The Sunshine in
Let the sunshine, let the sunshine in
The sunshine in

Let the sunshine, let the sunshine in
The Sunshine in
Let the sunshine, let the sunshine in
The sunshine in"
58,Tommy James & the Shondells,Crimson & Clover,1969,"Oh
Now I don't hardly know her
But I think I could love her
Crimson and clover

Ah
I wish she'd come walking over
Now I've been waiting to show her
Crimson and clover
Over and over

Yes 
(Da-da, da-da, da-da)
My, my, such a sweet thing 
(Da-da, da-da, da-da)
I want to do everything 
(Da-da, da-da, da-da)
What a beautiful feeling 
(Da-da, da-da, da-da)
Crimson and clover 
(Da-da, da-da, da-da)
Over and over

Crimson and clover, over and over
Crimson and clover, over and over
Crimson and clover, over and over
Crimson and clover, over and over
Crimson and clover, over and over
Crimson and clover, over and over"
59,Marvin Gaye,I Heard it Through the Grapevine,1968,"I bet you're wondering how I knew
'bout you're plans to make me blue
With some other guy you knew before
Between the two of us guys you know I love you more
It took me by surprise I must say
When I found out yesterday

Don't you know that I heard it through the grapevine?
Not much longer would you be mine
Oh I heard it through the grapevine
Oh and I'm just about to lose my mind
Honey, honey, yeah

Heard it through the grapevine?
Not much longer would you be mine, baby

I know that a man ain't supposed to cry
But these tears I can't hold inside
Losin' you would end my life you see
'Cause you mean that much to me
You could have told me yourself
That you love someone else

Instead, I heard it through the grapevine
Not much longer would you be mine
Oh I heard it through the grapevine
And I'm just about to lose my mind
Honey, honey, well

Heard it through the grapevine?
Not much longer would you be mine, baby

People say believe half of what you see
Son, and none of what you hear
But I can't help bein' confused
If it's true, please tell me, dear?
Do you plan to let me go
For the other guy you loved before?

Don't you know I heard it through the grapevine?
Not much longer would you be mine
Baby, I heard it through the grapevine
Ooh I'm just about to lose my mind
Honey, honey yeah

Heard it through the grapevine?
Not much longer would you be mine, baby

Honey, honey, I know
That you're letting me go
I said I heard through the grapevine
Ooh heard it through the grapevine"
60,The Box Tops,The Letter,1967,"Gimme a ticket for an aeroplane
Ain't got time to take a fast train
Lonely days are gone, I'm a-goin' home
My baby, just-a wrote me a letter

I don't care how much money I gotta spend
Got to get back to my baby again
Lonely days are gone, I'm a-goin' home
My baby, just-a wrote me a letter

Well, she wrote me a letter
Said she couldn't live without me no more
Listen mister, can't you see I got to get back
To my baby once-a more
Anyway, yeah!

Gimme a ticket for an aeroplane
Ain't got time to take a fast train
Lonely days are gone, I'm a-goin' home
My baby, just-a wrote me a letter

Well, she wrote me a letter
Said she couldn't live without me no more
Listen mister, can't you see I got to get back
To my baby once-a more
Anyway, yeah!

Gimme a ticket for an aeroplane
Ain't got time to take a fast train
Lonely days are gone, I'm a-goin' home
My baby, just-a wrote me a letter, my baby just-a wrote me a letter"
61,Paul & Paula,Hey Paula,1963,We do not have the lyrics for Hey Paula (Re-Recording) yet.
62,Kingsmen,Louie Louie,1963,"CHORUS:

Louie Louie, oh no
Me gotta go
Aye-yi-yi-yi, I said
Louie Louie, oh baby
Me gotta go

Fine little girl waits for me
Catch a ship across the sea
Sail that ship about, all alone
Never know if I make it home

CHORUS

Three nights and days I sail the sea
Think of girl, constantly
On that ship, I dream she's there
I smell the rose in her hair.

CHORUS

Okay, let's give it to 'em, right now!

GUITAR SOLO

See, see Jamaica, the moon above
It won't be long, we'll be below
Take her in my arms again
I'll tell her I'll never leave again

CHORUS

Let's take it on outa here now
Let's go!!"
63,The Ronettes,Be My Baby,1963,"The night we met I knew I needed you so
And if I had the chance I'd never let you go
So won't you say you love me? I'll make you so proud of me
We'll make 'em turn their heads every place we go

So won't you, please?
(Be my, be my baby)
Be my little baby
  (My one and only baby)
Say you'll be my darlin'
  (Be my, be my baby)
Be my baby now
  (My one and only baby)
Whoa oh oh oh

I'll make you happy, baby, just wait and see
For every kiss you give me, I'll give you three
Oh, since the day I saw you, I have been waiting for you
You know I will adore you 'til eternity

So won't you, please?
(Be my, be my baby)
Be my little baby
  (My one and only baby)
Say you'll be my darlin'
  (Be my, be my baby)
Be my baby now
  (My one and only baby)
Whoa oh oh oh

So come on and be
(Be my, be my baby)
Be my little baby
  (My one and only baby)
Say you'll be my darlin'
  (Be my, be my baby)
Be my baby now
  (My one and only baby)
Whoa oh oh oh

Be my, be my baby
(Be my little baby)
My one and only baby
Be my, be my baby
My one and only baby

Be my, be my baby
My one and only baby
Be my, be my baby"
64,Elvis Presley,Can't Help Falling in Love,1962,"Wise men say
Only fools rush in
But I can't help falling in love with you
Shall I stay?
Would it be a sin?
If I can't help falling in love with you

Like a river flows, surely to the sea
Darling so it goes, some things are meant to be

Take my hand
Take my whole life too
For I can't help falling in love with you

Like a river flows, surely to the sea
Darling so it goes, some things are meant to be

Take my hand
Take my whole life too
For I can't help falling in love with you
For I can't help falling in love with you"
65,Elvis Presley,In the Ghetto,1969,"As the snow flies
On a cold and gray Chicago mornin'
A poor little baby child is born
In the ghetto

And his mama cries
'Cause if there's one thing that she don't need
It's another hungry mouth to feed
In the ghetto

People, don't you understand
The child needs a helping hand
Or he'll grow to be
An angry young man some day

Take a look at you and me
Are we too blind to see
Go we simply turn our heads
And look the other way

Well the world turns
And a hungry little boy with a runny nose
Plays in the street as the cold wind blows
In the ghetto

And his hunger burns
So he starts to roam the streets at night
And he learns how to steal
And he learns how to fight
In the ghetto

Then one night in desperation
A young man breaks away
He buys a gun, steals a car,
Tries to run, but he don't get far
And his mama cries

As a crowd gathers 'round
An angry young man
Face down on the street
With a gun in his hand
In the ghetto

As her young man dies
On a cold and gray Chicago mornin'
Another little baby child is born
In the ghetto"
66,The Doors,Light My Fire,1967,"You know that it would be untrue
You know that I would be a liar
If I was to say to you
Girl, we couldn't get much higher

Come on baby light my fire
Come on baby light my fire
Try to set the night on, fire

The time to hesitate is through
No time to wallow in the mire
Try now we can only lose
And our love become a funeral pyre

Come on baby light my fire
Come on baby light my fire
Try to set the night on, fire yeah

The time to hesitate is through
No time to wallow in the mire
Try now we can only lose
And our love become a funeral pyre

Come on baby light my fire
Come on baby light my fire
Try to set the night on, fire yeah

You know that it would be untrue
You know that I would be a liar
If I was to say to you
Girl, we couldn't get much higher

Come on baby light my fire
Come on baby light my fire
Try to set the night on fire
Try to set the night on fire
Try to set the night on fire
Try to set the night on fire"
67,The Beatles,The Ballad of John & Yoko,1969,"Standing in the dock at Southampton
Trying to get to Holland or France
The man in the mac said
""You've got to go back""
You know, they didn't even give us a chance
Christ, you know it ain't easy
You know how hard it can be
The way things are going
They're gonna to crucify me
Finally made the plane into Paris
Honeymooning down by the Seine
Peter Brown called to say
You can make it okay
You can get married in Gibraltar near Spain
Christ, you know it ain't easy
You know how hard it can be
The way things are going
They're gonna to crucify me
So from Paris to the Amsterdam Hilton
Talking in our beds for a week
The news people said
""Say, what you doing in bed?""
I said, ""We're only trying to get us some peace""
Christ, you know it ain't easy
You know how hard it can be
The way things are going
They're gonna to crucify me
Saving up your money for a rainy day
Giving all your clothes to charity
Last night the wife said
Oh boy, when you're dead
You don't take nothing with you but your soul
Think!
Made a lightning trip to Vienna
Eating chocolate cake in a bag
Newspapers said
""She's gone to his head
They look just like two gurus in drag""
Christ, you know it ain't easy
You know how hard it can be
The way things are going
They're gonna to crucify me
Caught the early plane back to London
Fifty acorns tied in a sack
The men from the press
Said, ""We wish you success
It's good to have the both of you back""
Christ, you know it ain't easy
You know how hard it can be
The way things are going
They're gonna to crucify me
The way things are going
They're gonna to crucify me"
68,The Beatles,Can't Buy Me Love,1964,"Can't buy me love, love
Can't buy me love

I'll buy you a diamond ring my friend
If it makes you feel all right
I'll get you anything my friend
If it makes you feel all right
'Cause I don't care too much for money
For money can't buy me love

I'll give you all I've got to give
If you say you love me too
I may not have a lot to give
But what I've got I'll give to you
I don't care too much for money
For money can't buy me love

Can't buy me love
Everybody tells me so
Can't buy me love
No no no, no

Say you don't need no diamond rings
And I'll be satisfied
Tell me that you want the kind of things
That money just can't buy
I don't care too much for money
Money can't buy me love
Can't buy me love
Everybody tells me so
Can't buy me love
No no no, no

Say you don't need no diamond rings
And I'll be satisfied
Tell me that you want the kind of things
That money just can't buy
I don't care too much for money
Money can't buy me love

Can't buy me love, love
Can't buy me love, oh"
69,The Drifters,Save the Last Dance For Me,1960,"You can dance
Every dance with the guy
Who gave you the eye
Let him hold you tight

You can smile
Every smile for the man
Who held your hand
'Neath the pale moonlight

But don't forget who's taking you home
And in whose arms you're gonna be
So Darlin'
Save the last dance for me

Mmmmmh'

Oh I know (Oh I know)
That the music's fine (Yes I know)
Like sparkling wine (Oh I know)
Go and have your fun (Yes I know)
(Oh I know) Laugh and sing
(Yes I know) But while we're apart
(Oh I know) Don't give your heart
(Yes I know) To anyone (Oh I know)

But don't forget who's taking you home
And in whose arms you're gonna be
So Darlin'
Save the last dance for me

Mmmmh'

Baby don't you know I love you so?
Can't you feel it when we touch?
I will never never let you go
I love oh so much

You can dance (You can dance)
Go and carry on
'Till the night is gone
And it's time to go

If he asks
If you're all alone
Can he take you home
You must tell him no

'Cause don't forget who's taking you home
And in whose arms you're gonna be
So Darlin'
Save the last dance for me
'Cause don't forget who's taking you home
And in whose arms you're gonna be
So Darlin'
Save the last dance for me
Mmmh'
Save the last dance for me
Mmmm'
Save the last dance for me"
70,Nancy Sinatra,Somethin' Stupid,1967,"I know I stand in line until you think
You have the time to spend an evening with me
And if we go someplace to dance
I know that there's a chance you won't be leaving with me
And afterwards we drop into a quiet little place
And have a drink or two...
And then I go and spoil it all by saying
Something stupid like I love you

I can see it in your eyes that you despise
The same old lines you heard the night before...
And though it's just a line to you for me it's true...
And never seemed so right before
I practice everyday to find some clever lines
To say to make the meaning come true...
But then I think I'll wait until the evening gets late
And I'm alone with you
The time is right your perfume fills my head...
The stars get red and on the nights so blue...
And then I go and spoil it all by saying
Something stupid like I love you

SONGWRITERS
HART, LORENZ / RODGERS, RICHARD"
71,Creedence Clearwater Revival,Proud Mary,1969,"Left a good job in the city
Workin' for the man every night and day
And I never lost one minute of sleepin'
Worryin' 'bout the way things might have been

Big wheel keep on turnin'
Proud Mary keep on burnin'
Rollin', rollin', rollin' on the river

Cleaned a lot of plates in Memphis
Pumped a lot of pain down in New Orleans
But I never saw the good side of the city
'Til I hitched a ride on a river boat queen

Big wheel keep on turnin'
Proud Mary keep on burnin'
Rollin', rollin', rollin' on the river

Rollin', rollin', rollin' on the river

If you come down to the river
Bet you gonna find some people who live
You don't have to worry 'cause you have no money
People on the river are happy to give

Big wheel keep on turnin'
Proud Mary keep on burnin'
Rollin', rollin', rollin' on the river

Rollin', rollin', rollin' on the river
Rollin', rollin', rollin' on the river
Rollin', rollin', rollin' on the river"
72,Bobby Goldsboro,Honey,1968,"See the tree, how big it's grown
But friend, it hasn't been too long it wasn't big
I laughed at her and she got mad
The first day that she planted it was just a twig

Then the first snow came and she ran
Out to brush the snow away so it wouldn't die
Came runnin' in all excited
Slipped and almost hurt herself, I laughed 'til I cried

She was always young at heart
Kind a dumb and kind a smart and I loved her so
I surprised her with a puppy
Kept me up all Christmas Eve two years ago

And it would sure embarrass her when
I came home from working late 'cause I would know
That she'd been sittin' there cryin'
Over some sad and silly late, late show

And honey, I miss you and I'm being good
And I'd love to be with you if only I could
She wrecked the car and she was sad
And so afraid that I'd be mad but what the heck

Though I pretended hard to be
Guess you could say, she saw through me and hugged my neck
I came home unexpectedly
And found her crying needlessly in middle of the day

And it was in the early spring
When flowers bloom and Robin's sing, she went away
And honey, I miss you and I'm being good
And I'd love to be with you if only I could

Yes, one day while I wasn't home
While she was there and all alone, the angels came
Now all I have is memories of honey
And I wake up nights and call her name

Now my life's an empty stage
Where honey lived and honey played and love grew up
A small cloud passes over head
And cries down in the flower bed that honey loved

See the tree, how big it's grown"
73,John Fred & His Playboy Band,Judy in Disguise (With Glasses),1968,"Judy in disguise,
well, that's what you are,
lemonade pie
with a brand new car.
cantalope eyes come to me tonight
judy in disguise with glasses.
keep a-wearin' your bracelets
and your new rara,
cross your heart
with your living bra.
chimney sweep sparrow with guise
judy in disguise with glasses.
come to me tonight,
come to me tonight,
taking everything in sight,
and zip up the strings of my kite
judy in disguise,
well, what you aiming for,
a circus of horrors, yeah,
well that's what you are.
you made me a life of ashes,
i guess i'll just take your glasses"
74,Trini Lopez,If I Had a Hammer,1963,We do not have the lyrics for If I Had a Hammer yet.
